{
  "$schema": "https://json-schema.org/draft/2020-12/schema",
  "$id": "opex-integration/wave.schema.json",
  "title": "Multi-entity wave configuration",
  "type": "object",
  "additionalProperties": false,
  "required": ["waveKey", "direction", "entities"],
  "properties": {
    "$schemaVersion": { "type": "string", "enum": ["1"] },
    "waveKey":   { "type": "string", "pattern": "^[a-z][a-z0-9_]{2,40}$" },
    "direction": { "enum": ["inbound", "outbound", "mixed"] },
    "entities": {
      "type": "array",
      "minItems": 1,
      "items": {
        "type": "object",
        "additionalProperties": false,
        "required": ["entityKey", "phase"],
        "properties": {
          "entityKey":  { "type": "string", "pattern": "^[a-z][a-z0-9_]{2,40}$" },
          "phase":      { "type": "integer", "minimum": 1, "maximum": 20 },
          "dependsOn":  { "type": "array", "items": { "type": "string" }, "default": [] },
          "concurrent": { "type": "boolean", "default": true }
        }
      }
    },
    "failurePolicy": {
      "type": "object",
      "additionalProperties": false,
      "properties": {
        "onEntityFailure":         { "enum": ["stopWave", "continueIndependent", "continueAll"], "default": "continueIndependent" },
        "onDependencyFailure":     { "enum": ["skipDependent", "runAnyway"], "default": "skipDependent" },
        "wavePartialThresholdPct": { "type": "number", "minimum": 0, "maximum": 100, "default": 10 }
      }
    },
    "masterCacheRefresh": { "enum": ["never", "betweenPhases", "beforeEachEntity"], "default": "betweenPhases" },
    "configVersion":      { "enum": ["pinAtWaveStart", "latest"], "default": "latest" },
    "notification": {
      "type": "object",
      "additionalProperties": false,
      "properties": {
        "onWaveFailure": { "type": "array", "items": { "enum": ["email", "teams"] } },
        "onWavePartial": { "type": "array", "items": { "enum": ["email", "teams"] } }
      }
    }
  }
}
